"Welcome To Address Book Service In MySql Database"


---------------------------------------------------------
UC1 -> Create a database for address book service
---------------------------------------------------------

mysql>  CREATE DATABASE address_book_service;
Query OK, 1 row affected (0.01 sec)

mysql> Show databases;
+----------------------+
| Database             |
+----------------------+
| address_book_service |
| information_schema   |
| mysql                |
| payroll_service      |
| performance_schema   |
+----------------------+
5 rows in set (0.00 sec)

--------------------------------------------------------------------------
UC2 -> Create a table with various fields in address book service database
--------------------------------------------------------------------------

mysql>  USE address_book_service;
Database changed
mysql>  CREATE TABLE address_book(firstName VARCHAR(20) NOT NULL,
    -> lastName VARCHAR(20) NOT NULL,
    -> address VARCHAR(150) NOT NULL,
    ->  city VARCHAR(20) NOT NULL,
    -> state VARCHAR(20) NOT NULL,
    -> zip INT NOT NULL,
    -> phone_Number INT NOT NULL,
    ->  email_Id VARCHAR(30) NOT NULL);
Query OK, 0 rows affected (0.02 sec)

mysql>  DESCRIBE address_book;
+--------------+--------------+------+-----+---------+-------+
| Field        | Type         | Null | Key | Default | Extra |
+--------------+--------------+------+-----+---------+-------+
| firstName    | varchar(20)  | NO   |     | NULL    |       |
| lastName     | varchar(20)  | NO   |     | NULL    |       |
| address      | varchar(150) | NO   |     | NULL    |       |
| city         | varchar(20)  | NO   |     | NULL    |       |
| state        | varchar(20)  | NO   |     | NULL    |       |
| zip          | int          | NO   |     | NULL    |       |
| phone_Number | int          | NO   |     | NULL    |       |
| email_Id     | varchar(30)  | NO   |     | NULL    |       |
+--------------+--------------+------+-----+---------+-------+
8 rows in set (0.01 sec)


--------------------------------------------------------------------------
UC3 -> Added contacts to table of address book service database
--------------------------------------------------------------------------

mysql>  INSERT INTO address_book(firstName,lastName,address,city,state,zip,phone_Number,email_Id)VALUES
    -> ('Priyanka','Chaudhary','Sitamarhi','Patna','Bihar',45678,98765432,'priyanka@gmail.com'),
    -> ('Shweta','Thakur','Muzaffarpur','Patna','Bihar',1234,65432789,'shweta@gmail.com'),
    -> ('Luv','Sahu','Alwar','Alwar','Rajasthan',9876,12345678,'luv@gmail.com');
Query OK, 3 rows affected (0.01 sec)
Records: 3  Duplicates: 0  Warnings: 0

mysql> SELECT * FROM address_book;
+-----------+-----------+-------------+-------+-----------+-------+--------------+--------------------+
| firstName | lastName  | address     | city  | state     | zip   | phone_Number | email_Id           |
+-----------+-----------+-------------+-------+-----------+-------+--------------+--------------------+
| Priyanka  | Chaudhary | Sitamarhi   | Patna | Bihar     | 45678 |     98765432 | priyanka@gmail.com |
| Shweta    | Thakur    | Muzaffarpur | Patna | Bihar     |  1234 |     65432789 | shweta@gmail.com   |
| Luv       | Sahu      | Alwar       | Alwar | Rajasthan |  9876 |     12345678 | luv@gmail.com      |
+-----------+-----------+-------------+-------+-----------+-------+--------------+--------------------+
3 rows in set (0.00 sec)


--------------------------------------------------------------------------
UC4 -> Edit contact in a table of address book service database
--------------------------------------------------------------------------

mysql> update address_book set city = 'Gaya' where firstName = 'Shweta';
Query OK, 1 row affected (0.06 sec)
Rows matched: 1  Changed: 1  Warnings: 0

mysql>  SELECT * FROM address_book;
+-----------+-----------+-------------+-------+-----------+-------+--------------+--------------------+
| firstName | lastName  | address     | city  | state     | zip   | phone_Number | email_Id           |
+-----------+-----------+-------------+-------+-----------+-------+--------------+--------------------+
| Priyanka  | Chaudhary | Sitamarhi   | Patna | Bihar     | 45678 |     98765432 | priyanka@gmail.com |
| Shweta    | Thakur    | Muzaffarpur | Gaya  | Bihar     |  1234 |     65432789 | shweta@gmail.com   |
| Luv       | Sahu      | Alwar       | Alwar | Rajasthan |  9876 |     12345678 | luv@gmail.com      |
+-----------+-----------+-------------+-------+-----------+-------+--------------+--------------------+
3 rows in set (0.00 sec)


--------------------------------------------------------------------------
UC5 -> Delete contact in a table of address book service database
--------------------------------------------------------------------------

mysql>  DELETE FROM address_book WHERE firstName = 'Priyanka';
Query OK, 1 row affected (0.01 sec)

mysql> SELECT * FROM address_book;
+-----------+----------+-------------+-------+-----------+------+--------------+------------------+
| firstName | lastName | address     | city  | state     | zip  | phone_Number | email_Id         |
+-----------+----------+-------------+-------+-----------+------+--------------+------------------+
| Shweta    | Thakur   | Muzaffarpur | Gaya  | Bihar     | 1234 |     65432789 | shweta@gmail.com |
| Luv       | Sahu     | Alwar       | Alwar | Rajasthan | 9876 |     12345678 | luv@gmail.com    |
+-----------+----------+-------------+-------+-----------+------+--------------+------------------+
2 rows in set (0.00 sec)


--------------------------------------------------------------------------
UC6 -> Retrieve contact using city or state from a table of address book service database
--------------------------------------------------------------------------

mysql> SELECT * FROM address_book WHERE city = 'Alwar';
+-----------+----------+---------+-------+-----------+------+--------------+---------------+
| firstName | lastName | address | city  | state     | zip  | phone_Number | email_Id      |
+-----------+----------+---------+-------+-----------+------+--------------+---------------+
| Luv       | Sahu     | Alwar   | Alwar | Rajasthan | 9876 |     12345678 | luv@gmail.com |
+-----------+----------+---------+-------+-----------+------+--------------+---------------+
1 row in set (0.00 sec)

mysql> SELECT * FROM address_book WHERE city = 'Alwar' or state = 'Rajasthan';
+-----------+----------+---------+-------+-----------+------+--------------+---------------+
| firstName | lastName | address | city  | state     | zip  | phone_Number | email_Id      |
+-----------+----------+---------+-------+-----------+------+--------------+---------------+
| Luv       | Sahu     | Alwar   | Alwar | Rajasthan | 9876 |     12345678 | luv@gmail.com |
+-----------+----------+---------+-------+-----------+------+--------------+---------------+
1 row in set (0.00 sec)


